{
  "format": "canvas-render-eval-id-aliases-v1",
  "case_id": "human-edit/unicode-escape",
  "references_preserved": true,
  "event_reference_paths": [
    "/event_id",
    "/caused_by/*",
    "/payload/target",
    "/payload/request_event_id",
    "/payload/command_id"
  ],
  "derived_value_paths": [
    {
      "path": "/payload/fingerprint",
      "comparison": "recompute_from_canonical_projection"
    }
  ],
  "mappings": [
    {
      "kind": "session",
      "actual_id": "5b57b177-d5b4-4374-973f-6347378496fa",
      "alias": "session-01",
      "defined_at_seq": 1
    },
    {
      "kind": "event",
      "actual_id": "8293a054-5223-41aa-b56c-d4976e625081",
      "alias": "event-000001",
      "defined_at_seq": 1
    },
    {
      "kind": "event",
      "actual_id": "70c22c8f-ff77-4f3c-aa7e-e69fe9a2136a",
      "alias": "event-000002",
      "defined_at_seq": 2
    },
    {
      "kind": "event",
      "actual_id": "79be30d0-70ce-4fb1-8b02-2e086aa92e7b",
      "alias": "event-000003",
      "defined_at_seq": 3
    },
    {
      "kind": "event",
      "actual_id": "23d78820-31c0-4164-9a4c-a56ff1c6de42",
      "alias": "event-000004",
      "defined_at_seq": 4
    },
    {
      "kind": "command",
      "actual_id": "eval-1",
      "alias": "command-0001",
      "defined_at_seq": 3
    },
    {
      "kind": "command",
      "actual_id": "2986f781-5337-432e-997d-8f9d38b52654",
      "alias": "command-0002",
      "defined_at_seq": 4
    }
  ]
}
