{
  "format": "canvas-render-eval-id-aliases-v1",
  "case_id": "shared-undo/branch-invalidation",
  "references_preserved": true,
  "event_reference_paths": [
    "/event_id",
    "/caused_by/*",
    "/payload/target",
    "/payload/request_event_id",
    "/payload/command_id"
  ],
  "derived_value_paths": [
    {
      "path": "/payload/fingerprint",
      "comparison": "recompute_from_canonical_projection"
    }
  ],
  "mappings": [
    {
      "kind": "session",
      "actual_id": "26a77c3e-537c-4a3b-9e1b-28ed6208cc9b",
      "alias": "session-01",
      "defined_at_seq": 1
    },
    {
      "kind": "event",
      "actual_id": "f2807687-07f0-4337-8c5e-fa5095e11d8e",
      "alias": "event-000001",
      "defined_at_seq": 1
    },
    {
      "kind": "event",
      "actual_id": "bca4b5a1-8d1c-428a-b74a-eb333288b535",
      "alias": "event-000002",
      "defined_at_seq": 2
    },
    {
      "kind": "event",
      "actual_id": "82c21aaf-632a-4e94-8310-571ceca54b26",
      "alias": "event-000003",
      "defined_at_seq": 3
    },
    {
      "kind": "event",
      "actual_id": "03f2b9f0-3e65-4bc3-9f52-ee887267eef0",
      "alias": "event-000004",
      "defined_at_seq": 4
    },
    {
      "kind": "event",
      "actual_id": "53d6b97f-c741-4dd4-aab1-a7a73d5d9124",
      "alias": "event-000005",
      "defined_at_seq": 5
    },
    {
      "kind": "event",
      "actual_id": "2303a96b-b8f3-4400-bfc0-b4fd865abfed",
      "alias": "event-000006",
      "defined_at_seq": 6
    },
    {
      "kind": "command",
      "actual_id": "eval-1",
      "alias": "command-0001",
      "defined_at_seq": 3
    },
    {
      "kind": "command",
      "actual_id": "a70c410d-32b0-4d16-9b1f-d416b94e9801",
      "alias": "command-0002",
      "defined_at_seq": 4
    },
    {
      "kind": "command",
      "actual_id": "eval-3",
      "alias": "command-0003",
      "defined_at_seq": 5
    },
    {
      "kind": "command",
      "actual_id": "4382339a-96ee-4052-a0b6-29175a4f191c",
      "alias": "command-0004",
      "defined_at_seq": 6
    }
  ]
}
