{
  "format": "canvas-render-eval-id-aliases-v1",
  "case_id": "component-lifecycle/nominal",
  "references_preserved": true,
  "event_reference_paths": [
    "/event_id",
    "/caused_by/*",
    "/payload/target",
    "/payload/request_event_id",
    "/payload/command_id"
  ],
  "derived_value_paths": [
    {
      "path": "/payload/fingerprint",
      "comparison": "recompute_from_canonical_projection"
    }
  ],
  "mappings": [
    {
      "kind": "session",
      "actual_id": "6b9333ab-f2b1-4e68-b9bd-1edce47705da",
      "alias": "session-01",
      "defined_at_seq": 1
    },
    {
      "kind": "event",
      "actual_id": "5d1bb481-e0b4-45e5-8ff1-6fa926d6508a",
      "alias": "event-000001",
      "defined_at_seq": 1
    },
    {
      "kind": "event",
      "actual_id": "bbd1a29b-5b94-4422-97f1-95fd5c895e2c",
      "alias": "event-000002",
      "defined_at_seq": 2
    },
    {
      "kind": "event",
      "actual_id": "ab408bd8-7afd-4559-b392-242b4e677c94",
      "alias": "event-000003",
      "defined_at_seq": 3
    },
    {
      "kind": "event",
      "actual_id": "4c7c3858-0590-4a41-8841-b9447311f93d",
      "alias": "event-000004",
      "defined_at_seq": 4
    },
    {
      "kind": "event",
      "actual_id": "aec5adc6-510c-40fb-a057-923f98d6cc00",
      "alias": "event-000005",
      "defined_at_seq": 5
    },
    {
      "kind": "event",
      "actual_id": "4c145849-7f56-473d-b4d4-49d8b804ce02",
      "alias": "event-000006",
      "defined_at_seq": 6
    },
    {
      "kind": "event",
      "actual_id": "96542ae0-6a31-4bde-9110-cd571cbfa4a4",
      "alias": "event-000007",
      "defined_at_seq": 7
    },
    {
      "kind": "command",
      "actual_id": "eval-1",
      "alias": "command-0001",
      "defined_at_seq": 3
    },
    {
      "kind": "command",
      "actual_id": "eval-2",
      "alias": "command-0002",
      "defined_at_seq": 4
    },
    {
      "kind": "command",
      "actual_id": "eval-3",
      "alias": "command-0003",
      "defined_at_seq": 5
    },
    {
      "kind": "command",
      "actual_id": "eval-4",
      "alias": "command-0004",
      "defined_at_seq": 6
    },
    {
      "kind": "command",
      "actual_id": "eval-5",
      "alias": "command-0005",
      "defined_at_seq": 7
    },
    {
      "kind": "component",
      "actual_id": "card-8e368f92",
      "alias": "card-01",
      "defined_at_seq": 1
    }
  ]
}
