{
  "format": "canvas-render-eval-id-aliases-v1",
  "case_id": "human-edit/nominal",
  "references_preserved": true,
  "event_reference_paths": [
    "/event_id",
    "/caused_by/*",
    "/payload/target",
    "/payload/request_event_id",
    "/payload/command_id"
  ],
  "derived_value_paths": [
    {
      "path": "/payload/fingerprint",
      "comparison": "recompute_from_canonical_projection"
    }
  ],
  "mappings": [
    {
      "kind": "session",
      "actual_id": "4c2c5dcf-6586-4c26-8bd5-09ed58b9663b",
      "alias": "session-01",
      "defined_at_seq": 1
    },
    {
      "kind": "event",
      "actual_id": "4f9a48fa-eb8a-4d45-b64d-0eaffe07ac95",
      "alias": "event-000001",
      "defined_at_seq": 1
    },
    {
      "kind": "event",
      "actual_id": "36ec389a-3d4d-4cad-b571-b0213db5c466",
      "alias": "event-000002",
      "defined_at_seq": 2
    },
    {
      "kind": "event",
      "actual_id": "3584b9c7-e4a8-41d2-a3ea-2095baf26d03",
      "alias": "event-000003",
      "defined_at_seq": 3
    },
    {
      "kind": "event",
      "actual_id": "4feebe33-2b8c-4001-91c1-aba74836d5a1",
      "alias": "event-000004",
      "defined_at_seq": 4
    },
    {
      "kind": "command",
      "actual_id": "eval-1",
      "alias": "command-0001",
      "defined_at_seq": 3
    },
    {
      "kind": "command",
      "actual_id": "0082a092-3278-4e3b-8902-76d7a7ccaa6a",
      "alias": "command-0002",
      "defined_at_seq": 4
    }
  ]
}
