{
  "format": "canvas-render-eval-id-aliases-v1",
  "case_id": "human-edit/stale-conflict",
  "references_preserved": true,
  "event_reference_paths": [
    "/event_id",
    "/caused_by/*",
    "/payload/target",
    "/payload/request_event_id",
    "/payload/command_id"
  ],
  "derived_value_paths": [
    {
      "path": "/payload/fingerprint",
      "comparison": "recompute_from_canonical_projection"
    }
  ],
  "mappings": [
    {
      "kind": "session",
      "actual_id": "2f6bfd74-75e2-4ba7-b685-b06ee875769a",
      "alias": "session-01",
      "defined_at_seq": 1
    },
    {
      "kind": "event",
      "actual_id": "b329da3d-7773-4590-a26f-afb8ab2230e3",
      "alias": "event-000001",
      "defined_at_seq": 1
    },
    {
      "kind": "event",
      "actual_id": "0dd81c2b-fc91-4d83-83ae-917f42a0d8e4",
      "alias": "event-000002",
      "defined_at_seq": 2
    },
    {
      "kind": "event",
      "actual_id": "7570b21b-31f0-4508-a43b-de197580b5ab",
      "alias": "event-000003",
      "defined_at_seq": 3
    },
    {
      "kind": "event",
      "actual_id": "b4c2d59a-e666-45ac-a007-fcdbe541200d",
      "alias": "event-000004",
      "defined_at_seq": 4
    },
    {
      "kind": "command",
      "actual_id": "eval-1",
      "alias": "command-0001",
      "defined_at_seq": 3
    },
    {
      "kind": "command",
      "actual_id": "eval-2",
      "alias": "command-0002",
      "defined_at_seq": 4
    }
  ]
}
