{
  "format": "canvas-render-eval-id-aliases-v1",
  "case_id": "component-lifecycle/capacity",
  "references_preserved": true,
  "event_reference_paths": [
    "/event_id",
    "/caused_by/*",
    "/payload/target",
    "/payload/request_event_id",
    "/payload/command_id"
  ],
  "derived_value_paths": [
    {
      "path": "/payload/fingerprint",
      "comparison": "recompute_from_canonical_projection"
    }
  ],
  "mappings": [
    {
      "kind": "session",
      "actual_id": "837309e5-6d15-40e5-a16d-8cb38af67357",
      "alias": "session-01",
      "defined_at_seq": 1
    },
    {
      "kind": "event",
      "actual_id": "2e417cc6-57a7-40db-8cef-49e726d041c0",
      "alias": "event-000001",
      "defined_at_seq": 1
    },
    {
      "kind": "event",
      "actual_id": "1b84e241-2efb-4377-b03d-83bc595e3cd1",
      "alias": "event-000002",
      "defined_at_seq": 2
    },
    {
      "kind": "event",
      "actual_id": "62509d20-a8bf-4959-be9d-cff114f6bcad",
      "alias": "event-000003",
      "defined_at_seq": 3
    },
    {
      "kind": "event",
      "actual_id": "28746d64-2f24-4612-86e4-1772aa3d5083",
      "alias": "event-000004",
      "defined_at_seq": 4
    },
    {
      "kind": "event",
      "actual_id": "7abef533-d00c-4735-a8a5-aa87d173e007",
      "alias": "event-000005",
      "defined_at_seq": 5
    },
    {
      "kind": "event",
      "actual_id": "5255d45b-39a0-4600-8567-2efb04e96c42",
      "alias": "event-000006",
      "defined_at_seq": 6
    },
    {
      "kind": "event",
      "actual_id": "17170c18-b2b6-4559-a684-f7c9e2e74fff",
      "alias": "event-000007",
      "defined_at_seq": 7
    },
    {
      "kind": "event",
      "actual_id": "2564c98d-15fe-4fc4-8ca0-11757e127477",
      "alias": "event-000008",
      "defined_at_seq": 8
    },
    {
      "kind": "event",
      "actual_id": "641446e3-70e2-435b-94a5-66ffb9689d8e",
      "alias": "event-000009",
      "defined_at_seq": 9
    },
    {
      "kind": "command",
      "actual_id": "eval-1",
      "alias": "command-0001",
      "defined_at_seq": 3
    },
    {
      "kind": "command",
      "actual_id": "eval-2",
      "alias": "command-0002",
      "defined_at_seq": 4
    },
    {
      "kind": "command",
      "actual_id": "eval-3",
      "alias": "command-0003",
      "defined_at_seq": 5
    },
    {
      "kind": "command",
      "actual_id": "eval-4",
      "alias": "command-0004",
      "defined_at_seq": 6
    },
    {
      "kind": "command",
      "actual_id": "eval-5",
      "alias": "command-0005",
      "defined_at_seq": 7
    },
    {
      "kind": "command",
      "actual_id": "eval-6",
      "alias": "command-0006",
      "defined_at_seq": 8
    },
    {
      "kind": "command",
      "actual_id": "eval-7",
      "alias": "command-0007",
      "defined_at_seq": 9
    },
    {
      "kind": "component",
      "actual_id": "card-ec5b5362",
      "alias": "card-01",
      "defined_at_seq": 1
    },
    {
      "kind": "component",
      "actual_id": "card-fc585f9a",
      "alias": "card-02",
      "defined_at_seq": 1
    },
    {
      "kind": "component",
      "actual_id": "card-a3975f91",
      "alias": "card-03",
      "defined_at_seq": 1
    },
    {
      "kind": "component",
      "actual_id": "card-a07516dc",
      "alias": "card-04",
      "defined_at_seq": 1
    },
    {
      "kind": "component",
      "actual_id": "card-44322d0c",
      "alias": "card-05",
      "defined_at_seq": 1
    },
    {
      "kind": "component",
      "actual_id": "card-22a044df",
      "alias": "card-06",
      "defined_at_seq": 1
    }
  ]
}
